id,source,target,description,weight,links,in_context
1784,모바일소프트웨어트랙,모바일소프트웨어,모바일소프트웨어는 모바일소프트웨어트랙의 주제와 관련이 있음,9.0,6,True
109,모바일소프트웨어트랙,황기태,황기태 교수는 모바일소프트웨어트랙 트랙1에 소속되어 있음,40.0,6,True
118,모바일소프트웨어트랙,한기준,한기준 교수는 모바일소프트웨어트랙 트랙1에 소속되어 있음,10.0,6,True
139,박필준,모바일소프트웨어트랙,"박필준 교수는 모바일소프트웨어트랙 트랙2에 소속되어 있음
박필준 교수는 모바일소프트웨어트랙의 교수로 소속되어 있음",20.0,6,True
1783,모바일소프트웨어트랙,정병덕,정병덕 교수는 모바일소프트웨어트랙 트랙2에 소속되어 있음,10.0,6,True
371,모바일소프트웨어트랙,234567,234567 학생은 모바일소프트웨어트랙에 소속되어 있음,10.0,6,True
8,컴퓨터공학부,모바일소프트웨어트랙,모바일소프트웨어트랙은 컴퓨터공학부의 전공 트랙 중 하나로 소속되어 있습니다.,160.0,6,True
310,컴퓨터공학부,모바일소프트웨어,"모바일소프트웨어 트랙은 컴퓨터공학부의 트랙 중 하나로 소속되어 있으며, 서면신청 가능 과목에 포함됩니다.",27.0,6,True
107,컴퓨터공학부,황기태,황기태 교수는 컴퓨터공학부 소속 교수임,36.0,6,True
341,컴퓨터공학부,한기준,한기준 교수는 컴퓨터공학부 소속 교수임,9.0,6,True
1782,컴퓨터공학부,정병덕,정병덕 교수는 컴퓨터공학부 소속 교수임,9.0,6,True
1194,컴퓨터공학부,모바일 소프트웨어,모바일 소프트웨어 트랙은 컴퓨터공학부의 전공 심화 트랙 중 하나로 소속되어 있음,18.0,6,True
629,모바일소프트웨어트랙,안드로이드프로그래밍,안드로이드프로그래밍은 모바일소프트웨어트랙의 전공필수 과목임,20.0,3,True
401,안드로이드프로그래밍,황기태,황기태 강사는 안드로이드프로그래밍 과목의 강사로 활동하고 있음,10.0,3,True
404,안드로이드프로그래밍,박필준,박필준 강사는 안드로이드프로그래밍 과목의 강사로 활동하고 있음,10.0,3,True
16,한성대학교,모바일소프트웨어,모바일소프트웨어트랙은 한성대학교의 트랙 중 하나로 소속되어 있음,9.0,2,True
1,한기준,한성대학교,한기준 교수는 한성대학교 소속 교수임,9.0,2,True
1495,한성대학교,한기준,한기준 교수는 한성대학교 소속 교수임,1.0,2,True
647,모바일소프트웨어트랙,컴퓨터프로그래밍,"모바일소프트웨어트랙은 컴퓨터프로그래밍 과목을 포함하고 있으며, 이 과목은 모바일소프트웨어트랙의 기초 교과목 중 하나로, 전공기초 과목으로도 분류된다.",18.0,2,True
750,모바일소프트웨어,컴퓨터프로그래밍,모바일소프트웨어트랙에서 제공하는 필수 교과목 중 하나임,9.0,2,True
752,모바일소프트웨어,객체지향언어1,모바일소프트웨어트랙에서 제공하는 필수 교과목 중 하나임,9.0,2,True
394,객체지향언어1,황기태,황기태 교수는 객체지향언어1 과목의 담당 교수임,10.0,2,True
405,운영체제,황기태,황기태 강사는 운영체제 과목의 강사로 활동하고 있음,10.0,2,True
387,IOS프로그래밍,한기준,한기준 교수는 Ios프로그래밍 과목의 담당 교수임,10.0,2,True
389,IOS프로그래밍,박필준,박필준 교수는 Ios프로그래밍 과목의 담당 교수임,10.0,2,True
370,운영체제,234567,234567 학생은 운영체제를 수강해야 졸업할 수 있음,10.0,2,True
646,모바일소프트웨어트랙,캡스톤디자인,캡스톤디자인은 모바일소프트웨어트랙의 전공필수 과목임,10.0,1,True
644,모바일소프트웨어트랙,데이터마이닝,데이터마이닝은 모바일소프트웨어트랙의 전공선택으로 인정됨,9.0,1,True
372,빅데이터트랙,234567,234567 학생은 빅데이터트랙에 소속되어 있음,10.0,1,True
1321,웹공학트랙,황기태,황기태 교수는 웹공학트랙 트랙2에 소속되어 있음,20.0,1,True
117,모바일소프트웨어트랙,허준영,허준영 교수는 모바일소프트웨어트랙 트랙1에 소속되어 있음,10.0,1,True
119,모바일소프트웨어트랙,송미화,송미화 교수는 모바일소프트웨어트랙 트랙1에 소속되어 있음,10.0,1,True
645,모바일소프트웨어트랙,가상현실,가상현실은 모바일소프트웨어트랙의 전공선택으로 인정됨,9.0,1,True
121,모바일소프트웨어트랙,계희원,계희원 교수는 모바일소프트웨어트랙 트랙2에 소속되어 있음,10.0,1,True
138,계희원,모바일소프트웨어트랙,"계희원 교수는 모바일소프트웨어트랙의 교수로 소속되어 있음
계희원 교수는 모바일소프트웨어트랙 트랙2에 소속되어 있음",20.0,1,True
916,디지털콘텐츠 및 가상현실트랙,모바일소프트웨어트랙,디지털콘텐츠 및 가상현실트랙과 모바일소프트웨어트랙은 컴퓨터공학부의 트랙으로 서로 병렬적으로 위치함,8.0,1,True
110,모바일소프트웨어트랙,장재영,장재영 교수는 모바일소프트웨어트랙 트랙2에 소속되어 있음,40.0,1,True
115,모바일소프트웨어트랙,정인환,정인환 교수는 모바일소프트웨어트랙 트랙1에 소속되어 있음,10.0,1,True
120,모바일소프트웨어트랙,김남윤,김남윤 교수는 모바일소프트웨어트랙 트랙2에 소속되어 있음,10.0,1,True
631,모바일소프트웨어트랙,전공필수,모바일소프트웨어트랙은 전공필수 과목을 포함해야 졸업이 가능함,9.0,1,True
136,장재영,모바일소프트웨어트랙,"장재영 교수는 모바일소프트웨어트랙의 교수로 소속되어 있음
장재영 교수는 모바일소프트웨어트랙 트랙2에 소속되어 있음",20.0,1,True
137,김남윤,모바일소프트웨어트랙,"김남윤 교수는 모바일소프트웨어트랙 트랙2에 소속되어 있음
김남윤 교수는 모바일소프트웨어트랙의 교수로 소속되어 있음",20.0,1,True
116,모바일소프트웨어트랙,황호영,황호영 교수는 모바일소프트웨어트랙 트랙1에 소속되어 있음,10.0,1,True
630,모바일소프트웨어트랙,전공기초,모바일소프트웨어트랙은 전공기초 과목을 포함해야 졸업이 가능함,9.0,1,True
753,모바일소프트웨어,자료구조,모바일소프트웨어트랙에서 제공하는 필수 교과목 중 하나임,1.0,1,True
749,모바일소프트웨어,비즈니스 웹어플리케이션 구축 프로젝트,모바일소프트웨어트랙에서 제공하는 필수 교과목 중 하나임,9.0,1,True
751,모바일소프트웨어,프로그래밍랩,모바일소프트웨어트랙에서 제공하는 필수 교과목 중 하나임,9.0,1,True
1299,모바일소프트웨어트랙,웹프로그래밍 기초,웹프로그래밍 기초 과목은 모바일소프트웨어트랙의 기초 교과목 중 하나임,1.0,1,True
323,홍길동,모바일소프트웨어트랙,홍길동 학생은 모바일소프트웨어트랙에 소속되어 있음,10.0,1,True
757,모바일소프트웨어,고급모바일프로그래밍,모바일소프트웨어트랙에서 제공하는 필수 교과목 중 하나임,9.0,1,True
1300,모바일소프트웨어트랙,트랙기초 교과목,"트랙기초 교과목은 모바일소프트웨어트랙의 필수 과목으로, 학생들이 이수해야 함",9.0,1,True
748,모바일소프트웨어,AI를 이용한 주식가치평가,모바일소프트웨어트랙에서 제공하는 필수 교과목 중 하나임,9.0,1,True
400,모바일 캡스톤디자인,황기태,황기태 강사는 모바일 캡스톤디자인 과목의 강사로 활동하고 있음,10.0,1,True
754,모바일소프트웨어,모바일 & 스마트 시스템,모바일소프트웨어트랙에서 제공하는 필수 교과목 중 하나임,9.0,1,True
755,모바일소프트웨어,안드로이드 프로그래밍,모바일소프트웨어트랙에서 제공하는 필수 교과목 중 하나임,9.0,1,True
756,모바일소프트웨어,IOS 프로그래밍,모바일소프트웨어트랙에서 제공하는 필수 교과목 중 하나임,9.0,1,True
758,모바일소프트웨어,모바일 소프트웨어 캡스톤디자인,모바일소프트웨어트랙에서 제공하는 필수 교과목 중 하나임,9.0,1,True
0,한기준,HTTPS://DOCS.GOOGLE.COM/FORMS/D/E/1FAIPQLSFQSQ4BL0B43BQ5ZKAT4-H1RNORWTTE5SSRADZQ5AZKSUZLJG/VIEWFORM?USP=HEADER,한기준 교수는 캡스톤 수강자 대상 안내사항의 내용을 확인하기 위한 링크를 제공함,1.0,1,True
111,황기태,CALAFK@HANSUNG.AC.KR,황기태 교수의 이메일 연락처,50.0,1,True
112,황기태,02-760-4300,황기태 교수의 전화번호 연락처,50.0,1,True
128,한기준,KEEJUN.HAN@HANSUNG.AC.KR,한기준 교수의 이메일 연락처,10.0,1,True
129,한기준,02-760-4328,한기준 교수의 전화번호 연락처,10.0,1,True
1505,한기준,HTTPS://SITES.GOOGLE.COM/HANSUNG.AC.KR/AML/,한기준 교수의 연구실 웹사이트 주소,10.0,1,True
1502,APPLIED MACHINE LEARNING LAB,한기준,한기준 교수는 Applied Machine Learning Lab의 지도교수임,10.0,1,True
140,박필준,YULIAN@HANSUNG.KR,박필준 교수의 이메일 연락처,10.0,1,True
141,박필준,02-760-4487,박필준 교수의 전화번호 연락처,1.0,1,True
1786,정병덕,BDCHUNG@HANSUNG.KR,정병덕 교수의 이메일 연락처,10.0,1,True
1787,정병덕,02-760-4145,정병덕 교수의 전화번호 연락처,1.0,1,True
